Names,Address
1 Tablespoon,"23, Ram Villa, Opposite Sahkari Bhandar, Matunga East Opp Sahakari Bhandar, Matunga East,, Mumbai 400019 India"
10th Street Cafe,"Khar Pali Road, Road No 10, Khar Shop No 3 & 4, Mangal Bhavna, Mumbai 400049 India"
10th Street Cafe,"10th Road , Shop No 8 , Sukhmani Himalaya Coopertaive Society, JVPD Scheme, Mumbai 400049 India"
1441 Pizzeria,"Raj Infinia, Evershine Nagar Malad West Near Movie Time Cinema, Mumbai 400064 India"
1441 Pizzeria,"Senapati Bapat Road, Mumbai 400053 India"
1441 Pizzeria,"S.B Road Shop No 5, Ground Floor, Hari Chambers, 58 / 64, Fort, Mumbai 400001 India"
1441 Pizzeria Lokhandwala,"Shop Number 20, Ground Floor, Samartha Vaibhav CHS LTD., Mumbai 400053 India"
1441 Pizzeria Thane,"5 Pokhran Road Tiara Commercial Complex, Village Majiwada, Thane West, Near Gandhinagar Water Tank, Mumbai 400601 India"
145 Bandra,"Pali Road 1st Floor, HSBC Building, Mumbai 400050 India"
145 Cafe & Bar,"New Link Road 1st Floor, Ghanshyam Chambers, Mumbai 400053 India"
145 Kala Ghoda,"Mahatma Gandhi Road Temple Bar Building, 145, Fort, Mumbai 400001 India"
1701 Gastropub,"V.M. Road Nalanda Shopping Center Terrace, Mumbai 400056 India"
180 Degrees,"Ak Plaza Grand Sarovar Premiere, Mumbai 400062 India"
18th Century Rooftop Restro And Bar,"Samartha Vaibhav, 201/202 Lokhandwala Rd, Odd, New Link Rd, Mumbai 400053 India"
1BHK Brew House Kitchen,"Ground Floor, BST Colony Road, Oshiwara Linking Road, Andheri West, Mumbai 400102 India"
212 All Day Cafe & Bar,"Lbs Road F-97, First Floor, Phoenix Market City Mall, Kurla West, Mumbai 400070 India"
212 All Good,"Senapati Bapat Marg Ground Floor, Grand Galleria, High Street Phoenix, Lower Parel, Mumbai 400013 India"
24/7 Restaurant,"Sahar Airport Road, Andheri East The Lalit Mumbai, Mumbai 400059 India"
266 - The Wine Room & Bar,"266 Linking Road Bandra W, Mumbai 400050 India"
3 Wise Monkeys,"3'rd Road, Off Sv Road The Unicontental, Santacruz West, Khar West, Mumbai 400054 India"
38 Bangkok Street,"Cawasji Patel Street 3-6 Windsor Chambers, Fort Central, Mumbai 400001 India"
38 Degree East,"Lake Road Panchkutir, Next to Trinity Towers and VV Motors, Mumbai 400076 India"
5 Spice,"Opposite Mayur Tower Opposite Mayur Tower Opposite Mayur Tower, Borivali West, Mumbai 400092 India"
5 Spice,"Near Inorbit Mall Off Link Road Near Inorbit Mall Off Link Road Opposite Green Hotel, Mumbai 400064 India"
5 Spice,"91, Ground Floor, Shalimar Building, G Road, Near Everest Building, Marine Lines, Mumbai 400020 India"
5 Spice,"3/4 Dheeraj Pali Arcade Dr B R Ambedkar Road Near IDBI Bank ATM, Bandra West, Mumbai 400050 India"
5 Spice,"1st Floor, Swati Apartment, Anand Nagar, Link Road, Oshiwara, Andheri West, Opposite Mega Mall, Mumbai 400102 India"
5 Spice,"296/A Sangli Bank Building Perin Nariman Street Behind Old Reserve Bank Of India, Fort, Mumbai 400001 India"
5 Spice,"Ground Floor King Circle A1 H Adenwala Road, Mumbai 400019 India"
5 spice,"B. R. Ambedkar Road, Mumbai 400027 India"
5 spice,"Ballard Estate, Mumbai 400001 India"
5 Spice,"88, Shivai Industrial Estate, Andheri Kurla Road, Sakinaka, Opposite Woodland Showroom, Andheri East, Mumbai 400072 India"
6 Degrees,"Andheri Kurla Road The Leela Hotel, Lobby Level, Sahar, Andheri East, Mumbai 400059 India"
63bylane,"Shop no 63, Evershine Millenium Paradise, Bulding no 56 Thakur Village, Kandivali East, Mumbai 400101 India"
6th Street Yogurt,"Inorbit Mall, 2nd Floor, Link Road, Mindspace, Malad West, Mumbai 400064 India"
7 Scripts,"3 Surve Compound Satya Nagar Road Gala No. 3 Near Panchsheel Residency, Kandivali West, Mumbai 400067 India"
7 Scripts,"Satya Nagar Road, Kandivali West Gala No.3, Surve Compound, Mumbai 400067 India"
70 Beans,"8 /9, Vasundhara Height, Plot 5, Sector 11, Sanpada, Mumbai 400705 India"
72,"Sakinaka Junction, Andheri Kurla Road, Andheri East Holiday Inn, Mumbai 400072 India"
90ft Above,"L.T. Road The Rooftop, 7th Floor, Vini Elegance, Mumbai 400092 India"
90ML Bar & Kitchen,"Shop No 35, New Shopping Center, Near Cinemax Theatre, Bandra East, Mumbai 400051 India"
99 East,"45 Tarun Bharat CHS, Dr Karnjiya Road, Chakala, Andheri East Chakala, Opposite Cigarette Factory, Andheri East, Mumbai 400059 India"
99 Pancakes,"140, Ground Floor, Commerce house, Nagindas Master Road, Kala Ghoda, Near Ayubs, Fort, Mumbai 400001 India"
99 Pancakes,"Hanuman Road Sarva Mangal Apartment, Shop no 2, opp Datta Mandir,, Mumbai 400057 India"
A Bar,"& 3b Powai Renaissance Mumbai Convention Centre Hotel, Mumbai 400087 India"
A Ramanayak Udipi Shri Krishna Boarding,"1st Floor Lakhamsi Nappu Road Near Matunga Central Railway Station, Matunga, Mumbai 400019 India"
A Taste of India,"Centrium Mall, Lokhandwala Complex, Kandivali East Lokhandwala Township,Kandivali, Mumbai 400101 India"
Aarey Garden Restaurant,"Aarey Road, Near Central Dairy, Mumbai 400065 India"
Aashirwad Restaurant,"Opp. I.C Church, I C Colony, Borivali West, Mumbai 400103 India"
Aaswad,"61 Gokhale Road Mejwani, Sadanand Opp Amar Hind Mandal, Dadar, Mumbai 400028 India"
Aaswad,"Dadar West, Sena Bhavan Shivaji Park, Gadkari Chauk, Dadar West, Mumbai 400028 India"
Aaswad Upahar & Mithai Gruh,"Lady Jamshedji Road, Opposite Shivsena Bhavan Wavda Building, Gadkari Chowk Dadar, Mumbai 400028 India"
Aavakay - The Andhra Kitchen,"Shop No.1, Gayatri Satsang Building, Mumbai 400101 India"
Aayubs,"Aapejay House, Mumbai 400001 India"
AB Celestial,"Bandra Worli Sealink, Mumbai 400050 India"
AB3 - Akkad Bakkad Bombay Boo,"5 K K Meena Sudhar Marg Kamala Nagar, Bhagat Colony, Kandivali West, Mumbai 400067 India"
Abhinandan,"LBS Marg, Next to Damodar Park, Ghatkopar West Opp Sheyas Cinema, Mumbai 400086 India"
Above & Beyond,"Mahakali Caves Road Opp. Mc Donalds, Mumbai 400059 India"
"Absolute Barbecues, Powai","ATL Corporate Park, Saki Vihar Road, Powai Opp. L&T gate no.7, Mumbai 400087 India"
Abstrakt Bistro & Lounge,"Sion Trombay Rd Next to Surana Sethia Hospital, Opp Bezzolla Complex, Suman Nagar, Mumbai 400071 India"
Acharekar�s Malvan Katta,"3, Janaki Niwas, DL Vaidya Road Near Swami Samarth Math, Dadar West, Mumbai 400028 India"
Achija,"13 Vasant Nivas Tilak Road Naka Opposite HDFC Bank, Ghatkopar East, Mumbai 400077 India"
Achija,"Ganesh Gawde Road, Opposite Shraddha & Hiramonghi Hospital Ganesh Gavade Road, Mulund West, Mumbai 400080 India"
Adar Udipi Refreshment,"Sant Sakha Building, Nehru Road, Vile Parle East, Mumbai 400057 India"
Adarsh,"Ranade Road Dadar West, Mumbai 400028 India"
Adarsh Restaurant & Bar,"Ng Acharya Marg, Mumbai 400071 India"
Adhar Udupi Refreshment,"5 Nehru Road Sant Sakha Building, Vile Parle East, Mumbai 400057 India"
Aditi,"Opposite Kem Hospital Opposite Kem Hospital Parel, Opposite Kem Hospital, Mumbai 400012 India"
Aditi Fast Food,"Shri Vile Parle Patidar Wadi, Sardar Patel Bagh, Parleshwar Road, Vile Parle East, Mumbai 400057 India"
Aditi Fast Food,"105 S V Road Hotel Aditi International, Mumbai 400064 India"
Aer,"114 Dr E Moses Road Four Seasons Hotel, Mumbai 400018 India"
Afra,"4 Uttam Niwas Marol Maroshi Road, Mumbai 400059 India"
Afzal Restaurant,"36/37, Tulsiwadi, Shivdas Chapsi Marg, Opposite Sai Niketan Building, Mazgaon, Mumbai 400010 India"
Agent Jack's,"Palm Spring, Malad Link Road, Malad West, Mumbai 400064 India"
Ahar Restaurant & Bar,"467 Dr Ambedkar Road King Circle, Maheshwari Udyan, Matunga East, Mumbai 400019 India"
Aharveda,"Viral Apartments Opp Shoppers Stop , Behind Hotel RadhaKrishna, S. V. Road Hotel Golden Chariot Banquet Hall, Mumbai 400058 India"
AKA Bistro,"123 Nagindas Master Road Kalaghoda, Fort, Mumbai 400001 India"
AKA Restaurant,"Dr Annie Besant Road, Near Nehru Centre Ground floor, Lotus Cinema Building,, Mumbai 400018 India"
Al Fresco - The American Bistro,"4/277 I B Patel Road Behind H.P. Petrol Pump, Village Pahadi,, Mumbai 400063 India"
Alankar Restaurant,"Vithaldas Chambers Samachar Marg Mumbai Samachar Marg, Fort, Mumbai 400020 India"
Alfa Ice Cream,"9D, Readymoney Building, E Ward Municipal Office, Sankil Street, Byculla, Mumbai 400011 India"
Alfredo's,"Juhu Tara Road Opposite Juhu Bus Depot, Juhu, Mumbai 400049 India"
Alfredo's,"Royal Classic, New Link Road, Near Fame Ad Labs, Andheri Lokhandwala, Andheri West Near Infinity Mall, Andheri West, Mumbai, Mumbai 400049 India"
alfredos Malad,"Link Road Malad West Opp Movie times, Mumbai 400064 India"
Alibaba Barbeque & Seafood,"Apollo Bunder Road Dhanraj Mahal, Carnac Bridge, Mumbai 400001 India"
Alka Vihar,"S V Road, Opposite New Era Talkies, Mumbai 400064 India"
All Elements,"12th Road Opp Ram Mandir, Mumbai 400052 India"
All Seasons,"Western Express Highway, Opposite Metro Western Edge Borivali East, Mumbai 400066 India"
All Stir Fry,"5, Battery Street, Apollo Bunder, Colaba The Gordon House Hotel, Mumbai 400039 India"
All Stir Fry,"International Airport, Airport Rd Marol, Andheri East The Waterstones Hotel, Mumbai 400059 India"
Almond Flower,"461, Off Lokhandwala, Adarsh Nagar, Andheri West Opposite Samarth Aishwarya, Near Allana School, Oshiwara, Andheri West, Mumbai 400053 India"
Alps Restaurant and Beer Bar,"Behind Taj Intercontinental Behind Taj Intercontinental, Mumbai 400001 India"
Amadeus Lounge,"2 Ncpa N C P A Marg Gate No, Mumbai 400021 India"
Amantran Fine Dine,"Jn Road, Mumbai 400080 India"
Amar Fast Food & Restaurant,"Laram Centre, Next To Sunil Jewellers, S V Road, Andheri West Andheri West, Next To Sunil Jewellers, Mumbai 400058 India"
Amar Juice & Restaurant,"Andheri Kurla Road Building Number 1, Mittal Estate, Gala Number 9, Opposite Ten Square Building, Mumbai 400059 India"
Amar Juice Centre,"Gulmohar Road Near Amar Chemist, RN Cooper Hospital Compound, Vile Parle West, Mumbai 400056 India"
Amar Juice Centre,"D 39, NA Purandere Marg, Chowpatty Sea Face, Chowpatty, Mumbai 400004 India"
Amba Bhavan,"373, Patel Mahal, Bhandarkar Road, Matunga East Bhandarkar Road, Matunga, Mumbai 400019 India"
Ambience,"162/D Jagdamba Building Senapati Bapat Road Near Big Bazaar, Lower Parel, Mumbai 400013 India"
Ambience The Restaurant,"9 - 11 Tripati Tower Aihari Tekdi Road Thakur Comlpex, Kandivali East, Mumbai 400101 India"
Ambrosia Cafe and Deli,"Wellingdon Business Park Marol, Andheri east, Mumbai 400059 India"
American Express Bakery,"AEB House, 66 A. Mirza Galib Marg, Byculla, Mumbai 400008 India"
Americano,"123 Radha Bhavan, Nagindas Master Road, Mumbai 400001 India"
Amey,"Opposite MIG Cricket Club, Bandra East, Mumbai 400051 India"
Amrapali,"45 Nagindas Master Road Near Bombay Stock Exchange, Fort, Mumbai 400001 India"
Amritsari Tadka,"7 Evershine 2 Bon Bon Lane Seven Bungalows, Near Bon Bon Shoe Shop, Juhu, Mumbai 400061 India"
Amrut Sagar Fast Food,"5/49, Adeshir House, Hill Road, Near Ice Factory, Bandra West Near Ice Factory, Mumbai 400067 India"
Amrutsagar,"5 Adeshir House, 49 Hill Road Almeida Park Marg, Opposite Elco Market, Ranwar, Mumbai 400014 India"
Amul Classic Ice Cream,"10, Boman Behram Building, Opposite Super Bakery, Mazgaon, Byculla, Mumbai 400027 India"
Amuse Resto Bar,"Link Road Near Vijay Industrial Estate, Near Modi Hyundai Showroom, Chincholi, Malad, Mumbai 400064 India"
Anand Bhavan,"461/A, Ram Niwas, Maheshwari Udyan, Ambedkar Road, Matunga East Near Maheshwari Udyan, Matunga, Mumbai 400019 India"
Anand Bhuvan,"Ground Floor Kalbadevi Road 350 Shop No 348, Near Jama Masjid Kalbadevi, Opposite Punjab National Bank, Mumbai 400002 India"
And Chillies,"1, Sai Sadan CHS, PB Marg Near Paragon Compound, Worli, Mumbai 400101 India"
And Chillies,"1 Sai Sadan Co - Operative Society Shop No Pandurang Budhkar Marg, Mumbai 400013 India"
And Chillies,"Road Junction Mahim, 8 & 9, Mangireesh Society, Mahim West, Mumbai 400016 India"
And It Was Called Yellow,"Shop number 5 & 6, Geliki, ONGC Colony Nityanand Road Bandra Reclamation, Mumbai 400050 India"
Andaz cafe,"26, Samartha Vaibhav Near Blanco, Lokhandwala Rd, Andheri West, Mumbai 400053 India"
Andy's Bar and Kitchen,"Jagdamba Complex, Movie Time Premises, Malad West, Mumbai 400064 India"
Angrezi Dhaba,"2nd Floor, Nakshatra Mall, Dadar West, Mumbai 400028 India"
Angrezi Dhaba,"R R House Todi Ml Compound Ground Floor Senapati Bapat Marg, Mumbai 400013 India"
Angrezi Dhaba,"23/2 1st Floor, RM Building Mahalaxmi Station Bridge, Dr. E Moses Road, Mumbai 400018 India"
Angrezi Patiyalaa,"A-101, Crystal Plaza, Opposite Infinity Mall, KL Walawalkar Marg, Mumbai 400053 India"
Ankur - The Coastral Bistro,"77, Meadows House, Tamarind Lane, MP Shetty Marg, Behind Central Bank Of India, Fort, Mumbai 400001 India"
Ann Censored,"Shop No. 3, Ground Floor, C Wing Kamla Mills, Lower Parel, Mumbai, Maharashtra 400013 Shop No. 3, Ground Floor, C Wing Kamala Mills, Lower Parel, Mumbai 400013 India"
Anna Leela,"Shivlal Motilal Mansion, Bellasis Road Central Junction Mumbai Central, Near Maratha Mandir Cinema, Mumbai 400008 India"
Anna Punjabi,"Andheri Kurla Road Opp Kanakia Wallstreet 150, Mumbai 400093 India"
Anskhita Veg,"315 Shahid Bhagat Singh Road Opposite Fort Market,, Mumbai 400001 India"
Anugraha Pure Veg,"Sarvodaya Bhavan Gokhale Road North Dadar West, Near Gyan Mandir, Mumbai 400028 India"
Apeksha Veg Restaurant,"27 Apeksha Mudanna Shetty Marg, Mumbai 400001 India"
Apoorva,"Vasta House Noble Chambers Sa Brelvi Road, Mumbai 400001 India"
Apoorva Delicacies,"Ranade Road, Sushrusha Hospital, Dadar Shivaji Park Dadarm, Near Shushurasha Hospital, Mumbai 400028 India"
Apsara Ice Cream,"7, Kakad Estate Building, Dr. RG Thadani Marg, Opposite Poddar Hospital, Worli, Mumbai 400018 India"
Aqaba,"Level Senapati Bapat Marg Senapati Bapat Marg, Mumbai 400013 India"
Aqua- the 24 Hour Coffee Shop,"39 Juhu Beach Hotel Sun N Sand, Mumbai 400049 India"
Aquafire Restaurant,"5, Subhash Road Vile Parle East, Mumbai 400057 India"
Aquarius,"Ground Floor Colaba Causeway Road The Taj Mahal Palace, Mumbai, Mumbai 400001 India"
Aradhana,"1a Fakhruddin Manzil Khar Road Near Railway Station Near Railway Station, Mumbai 400052 India"
Aram,"Capitol Cinema Building M Cama Road, Opposite Railway Station Opposite Railway Station,, Mumbai 400001 India"
Aram Milk Bar,"126 Dr D N Road, Mumbai 400001 India"
Arbab,"8th Rd Plot no 117, Shop, no 4, Mumbai 400050 India"
Archana Restaurant,"Hotel Archana Residency, Next to R-Mall, L.B.S.Marg, Mulund West, Mumbai 400080 India"
Ark Bar,"Andheri Kurla Road Courtyard Mumbai International Airport hotel, Mumbai 400059 India"
Ark Vegetarian Fine Dine,"Swami Vivekanand Road Shop No 3A Milap Cinema, Mumbai 400067 India"
Aroma - On The Rocks Restaurant,"8/9, Basant Bahar CHS, Juhu Tara Road, Santacruz West, Mumbai 400054 India"
Aroma - The Cake Shop,"10 Mahavir Building Ganpatrao Kadam Marg Lower Parel West, Mumbai 400013 India"
Aromas Cafe,"Phoenix Market City, LBS Marg, Bandra Kurla Complex, Mumbai 400070 India"
Aromas Cafe - Oshiwara,"Link Plaza, 13/14 New Link Road, Oshiwara,Andheri West, Mumbai 400053 India"
Aromas Cafe & Bistro,"Ground floor, Mamta building, Bandra wesr Near National College, Mumbai 400050 India"
Aromas of China,"Ground Floor New Link Road Veera Desai Road, Mumbai 400058 India"
Aromas of China,"Oberoi Mall Goregaon East, Mumbai 400063 India"
Around D' Globe,"Shop No.3, Ground Floor, A-AHCL Homes, Link Road, Borivali West, Mumbai 400092 India"
Art House,"Art House Hemu Kalani Marg The Fern Residency, Mumbai 400071 India"
Arth,"15'th Road T P S 3 Plot No. 604, Pinnacle House, P D Hinduja Junction, Khar, Mumbai 400050 India"
Artisan,"C 57, Bandra Kurla Complex, Bandra East C-57, Bandra Kurla Complex, Bandra East, Mumbai 400051 India"
Arya Bhavan,"Ground Floor, Eastern Court, Parleshwar Road, Navpada, Vile Parle East, Mumbai 400057 India"
Arya Bhavan,"Free Press Journal Marg Dalamal Tower, Plot no-211, G-2, Ground Floor, Nariman Point, Mumbai 400021 India"
Arya Bhavan,"Shop No.9 &10, Bhanujyoti Building, L.N. Road, Opp. Matunga Railway Station, Matunga East, Mumbai 400019 India"
Asado Latin Grill,"Sv Road, Mumbai 400050 India"
Ashok Vada Pav,"Kashinath Duru Street, Veer Savarkar Marg, Prabhadevi, Near Keerti College, Dadar West, Mumbai 400025 India"
Ashwith Family Dining Bar,"5 - 7 Sai Sagar Building Near Canara Bank, Mumbai 400102 India"
Asia Kitchen & Bar,"Andheri Kurla Road Ground Floor, Neelkanth Udyog Bavan Near Sakinaka Metro Station Sakinaka Junction, Mumbai 400072 India"
Asia Kitchen by Mainland China,"Andheri Kurla Road Ground Floor, Neelkanth Udyog Bavan, Near Sakinaka Metro Station, Sakinaka Junction,, Mumbai 400072 India"
Asia Kitchen by Mainland China,"3rd Floor, Oberoi Mall Off Western Express Highway, Mumbai 400063 India"
Asian Street Kitchen,"Marine Drive, Mumbai 400020 India"
Asian Street Kitchen,"Dev Prakash Building, Chowpatty, Opposite Tilak Udyan, Girgaum, Mumbai 400004 India"
Asian Town,"1st floor, 4126, K. Dubhash Marg, 30, K Dubash Marg, Kala Ghoda 4126, 1st Floor, Kala Ghoda Fort, Mumbai 400001 India"
Asian Wok,"Galleria Shopping Mall, 151, 1st Floor, Hiranandani Gardens, Powai, Mumbai 400076 India"
Asilo,"462 Senapati Bapat Marg The St. Regis Rooftop, Lower Parel, Mumbai 400013 India"
Aswad Restaurant,"Court Naka, 60 Feet Road, Opposite Tahsildar Office, Vasai West, Mumbai 401303 India"
At MRP,"Oshiwara, Andheri west 3rd Floor, Om Heera Panna Mall, Mumbai 400058 India"
Atithi,"14 - 16 Jyanti Apartment Ground Floor Jata Shankar Dosa Road Opposite Railway Station, Mulund West, Mumbai 400080 India"
Atithi - Fine Dining,"L - 2 Mumbai (Bombay) Truck Terminal Street Hotel Heritage Supreme, Mumbai 400031 India"
"Atrium Bar & Lounge, Taj Lands End, Mumbai","Taj Lands End, Bandstand, Bandra West, Mumbai 400050 India"
August Cafe,"A-3, Sundervan Complex, Shastri Nagar, Andheri West, Mumbai, Mumbai 400058 India"
Aura Always Veg,"B6 Vrindavan Apartment Jn Of Link Road & Yogi Nagar Road, Mumbai 400091 India"
Aurus,"Juhu Tara Road Nichani Kutir, Opposite HDFC Bank, Juhu, Mumbai 400049 India"
Autumn Bar & Bistro,"New Link Road B-40, Unit 1-5, Patel Commercial Premises Coop Society, Andheri West, Opp City Mall, Mumbai 400053 India"
Ayub's,"5/43 Dr V B Gandhi Marg, Near Rhythm House, Mumbai 400001 India"
Ayyappa Dosa Corner,"Matunga, Mumbai 400019 India"
B Bhagat Tarachand,"69/75 Mumbadevi Commercial Center Zaveri Bazar, Mumbai 400002 India"
B Bhagat Tarachand,"Inorbit Mall, S-16, 2nd Floor, Sector 30A, Vashi, Mumbai 400703 India"
B Bhagat Tarachand,"Inorbit Mall, 18, 2nd Floor, Link Road, Mindspace, Malad West, Mumbai 400064 India"
B Kitchen & Bar,"Ground Floor Juhu Tara Road, Near Aza Kishore Kumar Bunglow, Mumbai 400049 India"
Baba Falooda,"52/1-2, Bell View Building, LJ 2nd Cross Road, Near Badi Darga, Mahim Shop No 2, 52, Bell View Building, Mumbai 400053 India"
Babu Vada Pav,"Hanuman Road Parle Tilak Vidyalaya, Vile Parle, Mumbai 400057 India"
Babulnath,"16, Babulnath Road Near Babulnath Temple, Malabar Hill, Mumbai 400006 India"
Babulnath Dosa Centre,"10 Sadguru Sadan 1'st Cooper Lane Opposite Babulnath Temple, Grant Road, Mumbai 400003 India"
Bade Miya,"7 & 8 Botawala Building & 9 Opposite Asiatic Library, Mumbai 400001 India"
Bade Miyan Laxmi Vilas,"Ground Floor, Ram Mansion, Building 19-A, Apollo Bunder, Near Taj Mahal Hotel, Colaba, Mumbai 400001 India"
Bademiya,"Tulloch Road, Apollo Bunder, Colaba Behind Taj Palace Hotel, Near Gateway of India, Mumbai 400005 India"
Bademiya Restaurant,"7/8/9, 6, Botawala Building, Near State Central Library, Horniman Circle, Fort, Mumbai 400001 India"
Badshah,"152/156 Umrigar Building Lokmanya Tilak Marg Opposite Crawford Market, Fort, Mumbai 400001 India"
Bagdadi Restaurant,"11, Tulloch Road, Apollo Bandar Colaba Behind Taj Inter Continental Hotel, Mumbai 400039 India"
Bageecha,"Balraj Sahani Road Novotel, Mumbai 400049 India"
Bageecha Restaurant,"167 Marve Road Orlem, Malad West, Mumbai 400064 India"
Ba�sic Kitchen,"309, Allied Industrial Estate, Mumbai 400016 India"
Baikoz Kitchen,"20 Meera Tower Shop No, Mumbai 400010 India"
Bake House Cafe,"KalaGhoda Building, 43 Ropewalk Lane, Behind Rhythm House, Kalaghoda, Fort, Mumbai, Mumbai 400001 India"
Baker Street,"Mumbai Airport T2 Departure Level, Mumbai 400099 India"
Bakers & More,"2 Sadashiv Building Tagore Road Opposite Podar Hall, Santacruz West, Mumbai 400054 India"
Balaji Idli House,"L B S Marg Shop No. 9, Nasibulla Compound, Mumbai 400086 India"
Balaji Pure Veg,"Western Express Highway, Mumbai 400063 India"
Balaji Pure Veg,"R City Mall, 3rd Floor, Amrut Nagar, LBS Marg, Ghatkopar West, Mumbai 400086 India"
Balaji Restaurant,"59 Hill Road Ramdas Naik Marg Opposite Landmark Building, Mumbai 400050 India"
Baluchi,"Sahar Airport Road The Lalit Mumbai, Mumbai 400059 India"
Balwas' Restaurant,"19, Maker Bhavan 3, New Marine Lines New Marine Lines, Near Bombay Hospital, Mumbai 400020 India"
Banana Leaf,"3rd Floor 31 Phase 2 3/31, 3rd Floor, R City Mall, Phase 2, Mumbai 400086 India"
Banana Leaf,"Lbs Marg Neptune Magnet Mall, R-305, 3rd Floor,, Mumbai 400078 India"
Banana Leaf,"Ground Floor 1 Juhu Versova Link Road 7 Bungalows, Opposite Vikram Petrol Pump, Andheri West, Mumbai 400058 India"
Banana Leaf,"G1-6, Floor, Thakur Village, Behind Vishnu Shivam Mall, Kandivali East, Mumbai 400101 India"
Banana Leaf Restaurant,"Link Road Aditya Building ,Ground Floor ,Gala Number 1,To, 8, Shimpoli, Borivali West, Mumbai 400057 India"
Banarasi Sweet Mart,"J.N. Road, Near Sinhal Classe, Santacruz East, Mumbai 400055 India"
Bangalore Iyengar's Bakery,"11, New Rupali Building, Evershine Nagar, Malad West, Mumbai 400064 India"
Banjara Dhaba,"Opposite Phillips Tower Building, Off Holy Cross Road, IC Colony, Borivali West, Mumbai 400091 India"
Banjara Family Restaurant,"Off Holy Cross Road Opposite Phillip Tower, Off Holy Cross Road, IC Colony, Mumbai 400092 India"
Banjara The Restaurant,"21 Central Road Plot No. 34, MIDC Andheri East, Goldfinch Hotel Mumbai, Mumbai 400093 India"
Bansi,"Chincholi Bunder Road, Malad West, Mumbai 400064 India"
Bansuri,"Near Deshmukh Garden Near Deshmukh Garden Mulund East, Near Deshmukh Garden, Mumbai 400081 India"
Bar 87,"Saki Vihar Road Ramada, 16/17, Paspoli, Powai, Mumbai 400087 India"
Bar Bank,"Hotel Beach Garden, Juhu Tara Road, Opp Hotel Ramada Plaza, Juhu, Mumbai, Maharashtra 400049, Mumbai 400049 India"
Bar Bar,"First Floor, Phoenix Marketcity, Lal Bahadur Shastri Marg, Kamani, Kurla, Mumbai, Mumbai 400070 India"
Bar Tales,"Runwal Greens, Mumbai 400080 India"
Baraanaa World Cocktail Bar & Kitchen,"Dr. Annie Besant Road, Opp. Poonam Chambers Level 3, Atria Mall, Worli, Mumbai 400018 India"
Barbecue Junction,"Shop 1, Balraj Sahani Road, Near Novotel Hotel, Juhu, Mumbai 400049 India"
Barbecue Nation,"Ground Floor 355 Almnestend Hill Road Hotel Metro Palace, Opposite Marks and Spencer, Mumbai 400050 India"
Barbeque Central,"Goregaon Link Road 1st Floor, Chandiwala Heritage, Opposite Bangur Nagar, Above Absolute Furniture, Mumbai 400104 India"
Barbeque Nation,"Kalyan Shil Road 2nd Floor, Metro Junction Mall, Mumbai 421306 India"
Barbeque Nation,"Off Link Rd Ground Floor, Dreams Square, Daliya Estate, Off Link Road, Mumbai 400053 India"
Barbeque Nation,"3, Ground Floor, Tower A, Time Square, Andheri-Kurla Road, Marol, Mumbai 400072 India"
Barbeque Nation,"Hill Road, Bandra Ground Floor, 355, Hotel Metro Palace , Opposite Marks and Spencer, Mumbai 400050 India"
Barbeque Nation,"Lal Bahadur Shastri Road 2nd Floor, Phoenix Paragaon Plaza, Mumbai 400070 India"
Barbeque Nation,"R Mall 3rd Floor Opposite To Richardson And Cruddas L B S Marg Mulund West, Mumbai 400080 India"
Barbeque Nation,"New Bypass Road 3rd Floor, Above Big Bazaar, Yashwant Building, Village Dongre By Pass Road YK Nagar, Virar, Mumbai 401303 India"
Barbeque Nation,"Dreams Square Ground Floor Near Fun Republic Mall Off Link Road Off Link Road, Near Fun Republic Mall, Andheri Lokhandwala, Mumbai 400053 India"
Barbeque Nation,"Dr. Annie Beasant Road Floor 4, Atria Mall, Opposite of Poonam Chambers, Worli, Mumbai 400018 India"
Baroke Lounge,"96/98 Sleater Road Hotel Krishna Palace, Nana Chowk, Mumbai 400007 India"
Barrel & Co,"New Link Road Ground Floor, Kotia Nirman, Near Fun Republic, Mumbai 400053 India"
Basil n' Spice,"Goregaon Mulund Link Road Runwal Greens, Ground Floor, Mumbai 400078 India"
Basil The Taste,"Shop 6, Viman Darshan Building, Opposite HSBC Bank, Sahar Road, Andheri East Shop No. 6, Mumbai 400069 India"
Baskin-Robbins,"2, Vintage CHS, IC Colony Near Citizen Bank, Borivali West, Mumbai 400091 India"
"Bastian, Bandra","Bandra Linking Road B/1, New Kamal Building, Mumbai 400050 India"
Bawa Suites,"352 Linking Road, Khar Opposite Khar Telephone Exchange, Khar West, Mumbai 400052 India"
Bawarchi,"250 Lokmanya Tilak Road, Opposite GT Hospital Opposite G T Hospital, Fort, Mumbai 400002 India"
Bay Leaf,"Near Reliance Webworld Thakur Complex, Near Reliance Webworld, Kandivali East, Mumbai 400101 India"
Bay Watch,"Aksa Beach, Madh-Marve Road, Malad West The Resort, Mumbai 400095 India"
Bayroute,"AB Nair Rd 14, Silver Beach Estate Opp Juhu Post Office Juhu, Mumbai 400049 India"
Bayroute,"Captain Prakash Pethe Marg Minoo Manor Building 7, Badhwar Park, Apollo Bandar, Mumbai 400005 India"
Bayroute,"G1, Transocean House, Lake Boulevard Road Hiranandani Business Park, Mumbai 400076 India"
Bayroute,"3rd North Avenue Maker Maxity G-2B, Ground Floor, Bandra Kurla Complex, Mumbai 400051 India"
Bayroute,"Phoenix Mills compound, Lower Parel Senapati Bapat Marg, Palladium, 3rd floor, Mumbai 400013 India"
Bayroute Cuffe Parade,"Minoo Manor Building 7 Dr Nanabhai Moos Marg, Mumbai 400005 India"
Bayview,"Juhu Tara Road Citizen Hotel, Mumbai 400049 India"
Bayview,"Gorai Road, Borivali West, Mumbai 400091 India"
Bayview Cafe,"4th Floor, 25, PJ Ramchandani Marg, Apollo Bunder, Colaba Hotel Harbour View, Mumbai 400001 India"
Behrouz Biryani,"Goregaon East, Mumbai 400063 India"
Being Hungry,"59, Sea Face Society CHS Ltd., Off Carter Road, Opoosite Amrit Building, Khar, Mumbai 400052 India"
Belstone,"Shop 4 Lower Parel West, Next to Kewal Industrial Estate, Near Phoenix Mall, Mumbai 400013 India"
Beluga,"Sahar Airport Road, Andheri East The Lalit Mumbai, Mumbai 400059 India"
