Names,Address
Kailash Parwat Hindu Hotel Restaurant,"5 1'st Pasta Lane Colaba Po, Mumbai 400005 India"
Kaitlyn's Beer Garden,"201-202, Khan House, Hill Road, Bandra West, Mumbai 400079 India"
Kaka Kaki,"Santacruz West, Mumbai 400054 India"
Kakori House,"Jigar Building, M.S. Ali Road, 10th Khetwadi, Grant Road, Mumbai 400007 India"
Kakori House,"Cci Churchgate, Mumbai 400020 India"
Kakori House,"4/5 My Fair Cooperative Housing Society New Link Road Building 25 Oshiwara, Andheri West, Opposite Meera Tower, Mumbai 400055 India"
Kakori House,"55 Kakori House Bazaar Road 2, Mini Apartment, Bandra West, Mumbai 400050 India"
Kakori House,"3, Ground Floor, Sag Baug, Andheri Kurla Rd, Sakinaka, Near Times Square, Andheri East, Mumbai 400069 India"
Kakori House,"10 A, Shiv Sagar Society, Opposite Paradise Cinema, LJ Road, Mahim Opposite Paradise Cinema, Mahim, Mumbai 400050 India"
Kale and Kaffe,"50 Laxmi Plaza,SAB TV Lane,New Link Road, Mumbai 400053 India"
Kalinga,"10 Nayayadeep Society Ground Floor New Link Road, Mumbai 400058 India"
KALPANA,"Lamington Road SM Mansion, Dr D B Marg, Mumbai 400008 India"
Kalpana Restaurant,"Nadava Bhavan Ground Floor Dr Annie Besant Road Opp City Bakery, Worli, Mumbai 400018 India"
Kalpana Restaurant,"254/56 Bhagat Singh Road Kalpana Building, Mumbai 400056 India"
Kalpana's Tastee,"Opposite Podar Hospital Opposite Podar Hospital, Mumbai 400018 India"
Kamat Hotel India Restaurant,"70C Nehru Road Vile Parle East Islampura, Mumbai 400099 India"
Kamat Hotel Restaurant,"Lokmanya Tilak Marg Opposite GT Hospital, Mumbai CST Area, Opposite Commisioner Office, Masjid Bunder, Mumbai 400002 India"
Kamat Restaurant,"75 Shahid Bhagatsingh Road Opposite Electric House, Donald House, Colaba Po, Mumbai 400005 India"
Kamats,"1/2, Maker Arcade, GD Somani Road, Cuffe Parade Near World Trade Centre, Mumbai 400005 India"
Kamat's Pure Vegetarian,"8, 9, 10, Sayani Road, Kapadawala Building, Prabhadevi Industrial Estate, Mumbai 400025 India"
Kamats Restaurant,"V. N. Purav Marg, Chembur Naka Hotel Maharana, Mumbai 400071 India"
Kamat's Suvidha,"Dr DN Road Opposite Cafe Shaheen, Fort, Mumbai 400001 India"
Kamling,"82 Nagin Mahal Ground Floor Veer Nariman Road, Mumbai 400020 India"
Kampa,"Vidhata App, Shop No 2,3, Navghar Road Near Saidhan Hospital, Mulund East, Mumbai 400081 India"
Kanchi,"Andheri Kurla Road, Near Times Square, Mumbai 400059 India"
Kandeel,"95 Ash Lane Fort, Opposite Mumbai University, Mumbai 400001 India"
Kandivli,"Akurli, Mumbai 400101 India"
Kangan,"Goregaon East, International Business Park, Oberoi Garden City, Mumbai 400063 India"
Kanishka Veg Restaurant,"1st Floor Tardeo Road B Shop No 5 Opposite Heera Panna Shopping Centre, Mumbai 400034 India"
Kansar Pure Veg Thali,"Ground Floor, Disha Apartment, Near Joggers Park, Chickoowadi, Borivali West, Mumbai, Mumbai 400092 India"
Karachi Sweets,"13, 55, Homeland Apartments, Ramdas Nayak Marg, 70, Hill Road Near Bandra Medical Store, Bandra West, Mumbai 400050 India"
Kareem's,"Carter Road Shop no. A 5, Gagangiri Commercial Complex, Khar West, Mumbai 400052 India"
Karma the Liquid Lounge,"534, Ground Floor, Opera House SVP Road, Mumbai 400007 India"
Kasbah,"Goregaon Link Road West Top Floor, Chandiwala Arcade, Motilal Nagar Next To Absolute World Furniture Boutique, Near Inorbit Mall, Mumbai 400090 India"
Kasbah Grand,"Link Road West Top Floor, Chandiwala Arcade, Motilal Nagar Next To Absolute World Furniture Boutique, Near Inorbit Mall, Mumbai 400090 India"
Kasino Bar,"8th Floor, Synergy Court, Kanchpada, Malad West, Mumbai 400064 India"
Kathi Kabab Roll,"1 Ibrahim Building Senapati Bapat Marg Opposite High Street Phoenix Mall, Lower Parel, Mumbai 400028 India"
Kathiyawad Ne Kangare,"Pelhar, Mumbai Ahmedabad Highway 8, Opposite Parmar Industries, Vasai East, Mumbai 401208 India"
Kayani Restaurant,"134 Lamington Road Opposite Navjivan Society, Ratan Heights, Mumbai 400007 India"
Kayani's,"Jiji House Opposite Sterling Cinema, Mumbai 400001 India"
Kazan,"Off. Andheri Link Road Oberoi Chamber 1, opp tanishq showroom, Andheri West, Mumbai 400058 India"
Kebab Corner,"12 New Malini Apartments Mahakali Caves Road Near Conossa Convent School, Mumbai 400093 India"
Kebab Gunj,"Arthur Bunder Road 1C/3A, Ground Floor, Kamal Mansion, Near Radio Club, HNA Azmi Marg, Colaba, Mumbai 400003 India"
Kebab Korner,"135, Mumbai 400020 India"
Kebab Korner,"135, Churchgate Hotel InterContinental, Mumbai 400020 India"
Kebabs & Curries,"12-5/5, Jangid Towers, Green Park Opposite Syndicate Bank, Mira Road East, Mumbai 401107 India"
Kebabs & Kurries,"287 Dr B R Ambedkar Road ITC Grand Central Hotel, Mumbai 400067 India"
Keiba,"Mahalaxmi Racecourse Royal Western India Turf Club, Mahalakshmi, Mumbai 400018 India"
Kepchaki Momos,"4B, Gagangiri Apartments, Off Carter Road, Near Gold Mist, Khar West, Mumbai 400052 India"
Kerala Cafe,"St. Alphonsa Road Dosti Road, Behind Stella Petrol Pump, Vasai, Mumbai 401202 India"
Kerala House,"Block No. A, Vashi, Plot No. 8, Sector 30, Mumbai 400703 India"
Kettle & Keg,"14th Road, Khar West Shop N.1, Celeste Building, Plot No.470, Kinchin Cooperative Housing Society, Mumbai 400052 India"
Kettle & Keg versova,"Shop 3-4, opp. Marine Vue Bldg, J.P. Road, Mumbai 400061 India"
Keventers,"Sodawala Lane Shop no 7, Natraj Borivali, CHS, Borivali West, Mumbai 400091 India"
Keys Cafe,"Makwana Road, Off Military Road, Mumbai 400059 India"
KFC,"Inorbit Mall, 21/B, 2nd Floor, Link Road, Mindspace, Malad West, Mumbai 400064 India"
KFC,"20 Lal Bahadur Shastri Road, Mumbai 400070 India"
Khana Khazana,"275 Premji Bhavan Raja Rammohan Roy Road Near Central Plaza, Near Khandelwal Classes, Charni Road, Mumbai 400004 India"
Khana Khazana,"Post Office Road, Near Tide Water And Oil Govandi, Mumbai 400088 India"
Khandani Rajdhani,"2nd Floor Bandra Kurla Complex Road, Mumbai 400070 India"
Khane Khas,"4 33'rd Road Bandra West, Opposite Guru Nanak Medicals, Mumbai 400050 India"
"Khao Piyo Jo Bhi Chaho, Yahan Khao","Lotia Palace Gr. Floor, Linking Rd, Opp. Citi Bank Khar West, Mumbai 400052 India"
Khar Social,"5th Rd S.V. Road, Khar West, Khar,, Mumbai 400052 India"
khasiyat fast food,"Vile Parle, Mumbai 400056 India"
Khasiyat the Paratha House,"21 Khasiyat the Paratha House Khasiyat The Paratha House Khasiyat The Paratha House Khasiyat The Paratha House Dashrathlal Joshi Road Near Indian Oil, Vile Parle West, Mumbai 400092 India"
Khau Galli,"SV Rd Kandivali, Mumbai 400067 India"
Khichdi Garden,"Simpoli Road, Opp Reliance Mall, Dalvi Nagar, Mumbai 400092 India"
Khichdi The Global Food,"ML Spaces, Opp Jain Mandir, Opp Mcdonals, Besant Rd Vile Parle West, Mumbai 400056 India"
Khiva,"Lal Bahadur Shastri Marg F-32, Phoenix Marketcity, Kamani, Kurla, Mumbai 400070 India"
Khiva Royal Frontier Cuisine,"LBS Marg, Bhandup, Mumbai 400078 India"
Khow Chow,"Waterfield Road Shop # 2 New Kamal CHS, Mumbai 400050 India"
Khyber,"Ground Floor 145 Mahatma Gandhi Road Near Rhythm House, Fort, Mumbai 400001 India"
Khyber at Malad,"Link Road, Near Inorbit Mall, Mumbai 400064 India"
Kinara,"1 Sahar Indian Oil Road Off Sahar Airport Road, Opposite Medicon Bhavan, Andheri East, Mumbai 400099 India"
Kinara Dhaba,"Sasupada, Mumbai Ahmedabad Highway 8, Near Ghodbunder Bridge, Vasai East, Mumbai 400057 India"
Kinara Dhaba Restaurant & Bar,"Godbunder Bridge Andheri, Mumbai 400053 India"
King Chilli,"2, Koteshwar Palace, Jiva Mahale Road Near SBI ATM, Andheri East, Mumbai 400069 India"
King Chilli Chindian Fusion,"Kalina Kurla Road, Opp Bank Of Baroda Shop No.10, A179, Lovely Homes, Mumbai 400029 India"
King Chilli Chindian Fusion,"Shop No. 2 3 4, Ruby Palace, Ceaser Road, Amboli Andheri West, Opposite Filmaya Studio, Mumbai 400058 India"
King Chilli Oriental Restaurant,"132 Kalina Kurla Road Near Kalina Masjid, Santacruz East, Mumbai 400098 India"
Kings Kulfi,"Lbs Marg, Mumbai 400086 India"
King's Shawarma,"Shop 3, Dariwala Building, Maulana Shaukat Ali Road, Grant Road, Mumbai 400007 India"
KIPOS Eatery & Bar,"33'rd Road 5th floor, Crystal Shoppers Paradise, Corner of 33rd and 24th, Mumbai 400050 India"
Kirti Mahal,"Mg Road Panch Rasta, Mumbai 400080 India"
Kirti Mahal Veg,"1 - 3 Lav Kush Cooperative Housing Society Mahatma Gandhi Road Near Ent Hospital, Mulund East, Mumbai 400086 India"
Kitchen Garden,"C - 101 Saint John Street Pali Hill, Mumbai 400050 India"
Kitchen Stories India,"5AA, MAc Ronells, ST Andrews Road, Pali Hill, Bandra west Same bungalow as Krome Studios Mumbai, Mumbai 400050 India"
Knotty Yard,"1st Floor, Opposite Powai Hiranandani Bus Depot, Besides Jal Vayu Vihar, Above China Valley Powai, Mumbai 400076 India"
kobe,"Hill Road, Mumbai 400050 India"
Kobe Sizzler And Snack Bar,"13/14 Hughes Road Sukh Dagar,, Mumbai 400007 India"
Kobe Sizzlers,"2, Town Centre Building, Andheri Kurla Road, Sakinaka, Near Times Square, Andheri East Near Mittal Estate, Town Centre Building, Mumbai 400058 India"
Kobe Sizzlers,"12/13, Ground Floor, Sukh Sagar Building, Opera House, Hughes Road, Near Reliance World, Girgaum, Mumbai 400007 India"
Kobe Sizzlers,"1, Hill Road, Near St Andrews Church, Bandra West, Mumbai 400050 India"
Kode,"Pandurang Budhkar Marg Ground Floor-II, Entrance Gate 4 Trade View, Oasis City, Mumbai 400013 India"
Kofuku Japanese,"Suburbia Mall, Linking Road Bandra West 6th Floor, Mumbai 400050 India"
Koh by Ian Kittichai,"Intercontinental Hotel, 135 Marine Lines Churchgate, Mumbai 400020 India"
Kokani Katta,"Gound Floor, P R. Building, Near Sunni Shafi Jama Masjid, Kalwa, Mumbai 401107 India"
KOKO Asian Gastropub,"Kamala Mills Compound, Ground Floor, Kamala Mills, Lower Parel, Mumbai 400013 India"
Kolhapuri Chivda,"237/A, Naik Building, JSS Road Near State Bank Of India, Girgaum, Mumbai 400004 India"
Konark Veg Diet,"23/24 Rangoli Vasant Utsav Kandivali East, Near Thakur College, Mumbai 400101 India"
Konkan Chilly,"2, Ganga Niwas, Chincholi Bunder Mindspace, Malad West, Opposite Evershine Mall, Mumbai 400064 India"
Konkan Kinara,"284, Rdp 3, Shri Bhalchandra Maharaj Chs Limited, Sahyadri Nagar, Charkop, Kandivali West, Mumbai 400067 India"
Konkan Kubera,"Shop No 1, 2 & 3, Annex Mall, Off Western Express Highway No. 8, Borivali Eastss Highway, Borivali East, Mumbai 400066 India"
Konkan Swad,"4, MG Road, Bangur Nagar Junction Goregaon West, Near Hyper City Mall, Mumbai 400104 India"
Kook,"Chembur Mahul Road, R.C marg Swami Jayramadas Shopping Centre, Near Basant Park, Chembur, Mumbai 400071 India"
Koolar and Co,"541, Noor Mahal, Dr Babasaheb Ambedkar Road, Opposite Yes Bank Kings Circle, Matunga, Mumbai 400019 India"
Kosho,"D1 Nahar Shopping Complex Chandivali Nahar Amrit Shallti Chandivali, Powai, Mumbai 400076 India"
Koyla,"B47 Paramount 2nd Floor New Link Road, Mumbai 400053 India"
Koyla Ethnic Cuisine,"3/23 Kamal Mansion N A Azmi Road Next To Radio Club, Kamal Mansion, Colaba Po, Mumbai 400005 India"
Koyla Ethnic Cuisine,"JP Road Versova, Andheri West, Mumbai 400061 India"
Krishna Murari,"344/46, Damodar Bhavan, Kalbadevi Road, Kalbadevi, Mumbai 400002 India"
Kuai Kitchen,"Shop no 3/4, Khar Pali Rd, Mumbai 400052 India"
Kuai Kitchen,"Shahid Bhagat Singh Road 16/A, Cusrow Baug, Mumbai 400001 India"
Kubera Veg Treat,"Vasai Station Road Dewan Tower, Opposite Parvati Cinema, Mumbai 401202 India"
Kukus Chinese Restaurant,"Near Diamond Theatre Diamond Lokmanya Tilak Road, Mumbai 400092 India"
Kung Food,"B - 18 Government Colony Road, Mumbai 400051 India"
Kung Fu Panda,"3, Indo Saigon Estate, Marol, Near Mittal Industrial Estate, Andheri East, Mumbai 400059 India"
Kunjvihar,"1, Ratna Niwas, Station Road Opposite Railway Station, Dombivli East, Mumbai 421201 India"
Kurry Klub,"5, Indian Mercantile Mansion Building, Madam Cama Road Colaba, Opposite Regal Cinema, Mumbai 400001 India"
Kusum Rolls,"Link Road 6, King Palace, Chincholi Bunder, Malad West, Mumbai 400064 India"
L Oh Pool & Bar,"C 57 Sofitel Mumbai BKC Bandra Kurla Complex, Block G, Bandra East, Mumbai 400051 India"
L&S Bistro,"Marine Drive, Churchgate Intercontinental, Mumbai 400020 India"
L5 Fine Dine,"Level 5, The Destination Next To Shopper's Stop, Ghatkopar East, Mumbai 400089 India"
La loca maria,"Carlton Court, Corner of Turner Road Signal, Near Citibank ATM, Pali Hill, Bandra West, Mumbai, Mumbai 400050 India"
La Lola,"Kamala Mills L3, Trade View Towers, Lower Parel, Mumbai 400013 India"
La Patio,"8th Floor Morya Landmark 2 802 New Link Road Opposite Infinity Mall, Andheri West, Mumbai 400053 India"
La Pino'z Pizza,"A-8/7, Rd Number 24, Mumbai 400022 India"
La Pino'z Pizza,"G1 Santoor Residency Nehru Road, Mumbai 400057 India"
La Pizzeria,"Shop No. 3, Pheroze Building Chhatrapati Shivaji Maharaj Marg, Colaba, Mumbai 400001 India"
La Veggie,"S V P Road CS No 6/15/17, Opera House, Sandhurst Bridge, Chowpatty, Girgaon, Mumbai 400007 India"
Ladoo Samrat,"1 & 2 Habib Terrace, Dr BA Road, Lalbaug, Parel, Mumbai 400012 India"
Lady Baga,"Oasis Complex, Kamala Mills, Gate 4, Lower Parel, Mumbai 400013 India"
La-Gwa Bistro,"Royal Apartments 1 Shop No panch Marg, Opposite akanksha towers, Yari Road, Versova, Andheri West, Mumbai 400061 India"
Lake View Cafe,"Aarey Powai Road Renaissance Hotel & Convention Centre, Mumbai 400087 India"
Lalit Bakery,"Charkop Market, Sector 1, Kandivali West, Mumbai 400067 India"
Lalit Fine Dine,"Ground Floor, Topiwala Building, Station Road, Near Topiwala Talkies, Goregaon West, Mumbai 400006 India"
Lalit Restaurant,"6/7, Stock Exchange Fountain, Fort, Mumbai 400001 India"
Lambas Punjabi Restaurant,"Sion Trombay Road Sion Trombay Road Chembur West, Opposite Diamond Garden, Mumbai 400071 India"
Landmark,"New Link Road Near Children's Hospital, Mumbai 400064 India"
Landmark Fine Dine,"Landmark Residency, Adarsh Road, Liberty Garden Road, Opposite SNDT College, Malad West Opposite S.N.D.T College, Malad West, Mumbai 400064 India"
Lassi Te Parrontthe,"Carter Road, Mumbai 400052 India"
Laughing Cavalier,"Malad, Mumbai 400064 India"
Laxmi Punjab,"5 Andheri Kurla Road Andheri East, Opposite Gurunanak Petrol Pump, Mumbai 400069 India"
Laxmi Veg Restaurant,"Adi Shankaracharya Road Excel Building, Powai, Mumbai 400076 India"
Le Bar Diamantaire,"C 57, Bandra Kurla Complex, Bandra East Sofitel Hotel, Mumbai 400051 India"
Le Cafe,"Ground Floor G - 42 L B S Marg, Mumbai 400086 India"
Le Cafe,"1'st Road Hotel Jewel Of Chembur, Near Natraj Cinema, Mumbai 400071 India"
Le Cirque Signature,"8th Floor Andheri Kurla Road, Mumbai 400059 India"
Le Mangii,"Ground Floor Ab Nair Road Near Juhu Post office, Juhu, Mumbai 400059 India"
Le Paan,"Central Ave, Opp D Mart, Mumbai 400076 India"
Le Pain Quotidien,"3 Maker Maxity North Avenue Maker Maxity, Mumbai 400051 India"
Le Pain Quotidien,"Central Avenue, Hiranandani Gardens 1st Floor, Rodas Hotel, Mumbai 400076 India"
Le Pain Quotidien,"A Wing 2 Prathmesh Tower Senapati Bapat Marg Tower 2, A Wing, Mumbai 400013 India"
Leaping Windows,"3 Corner View Bianca Yari Road Off Yari Road, Opp. Bianca Towers, Andheri West, Mumbai 400061 India"
Legacy of China,"61/2 Bungalows, Tirupati Towers, JP Road, 7 Bungalows, Opposite Canara Bank, Versova Triupati Towers, Versova, Andheri, Mumbai 400053 India"
Lemon Grass,"4 Carlton Court Manuel Gonsalves Road Pali Hill, Bandra West, Opposite UTI Bank, Mumbai 400050 India"
Lemon grass,"Dr. Ambedkar road, bandra, Mumbai 400052 India"
Lemon Leaf,"Mandlik Rd 4 garden chalet, Apollo Bandar, Mumbai 400001 India"
Lemon Leaf,"Raheja Classic Lane Ground Floor, Royal Sands Building, Off Lokhandwala Complex, Phase D, Mumbai 400053 India"
Lemon N Spice,"Svp Road, Prarthana Samaj, Girgaum, Mumbai 400004 India"
Leopold Cafe,"Shaheed Bhagat Singh Road Colaba Causeway, Mumbai 400005 India"
Let's Talk Fish,"I A Project Road Unit F9/F10, 1st Floor, Near Chhatrapati Shivaji International Airport, , Chakala, Mumbai 400099 India"
Li Bai,"Level 37, 462 Senapati Bapat Marg, Lower Parel Palladium Hotel, Mumbai 400013 India"
Liberty La Classique,"Siddhivinayak Tower Tank Road, Off Shankar Lane, Mumbai 400064 India"
Liberty Lunch Home,"3F Wellington Street, Dhobi Talav Marine Lines, Near Metro Maszid, Mumbai 400002 India"
Liberty Veg Restaurant,"Jasville, Opposite Liberty Cinema, Near Bombay Hospital, 9, New Marine Lines,, Mumbai 400020 India"
Light House Cafe,"Doctor Annie Besant Road 9, Ground Floor, Sunville Banquet Building, Mumbai 400018 India"
Light House Cafe,"3rd Rd Khar West, Mumbai 400052 India"
Light House Cafe,"9 Ground Floor, Sunville Banquets, Dr Annie Besant Road, Siddharth Nagar,, Mumbai 400018 India"
Light of Bharat,"No 69 Meher Building Ground Floor Esplande Road, Mumbai 400028 India"
Lilt,"Mathuradas Mill Compound, N.M. Joshi Marg, Lower Parel Plot 242, Mumbai 400013 India"
Lima Restaurant & Bar,"2 North Avenue Maker Maxity, BKC, Mumbai 400051 India"
Ling's Pavilion,"19/21 Mahakavi Bhushan Marg Behind Regal Cinema, Colaba, Mumbai 400001 India"
Lion Heart Lounge,"Dr Baba Saheb Ambedkar Rd Irani Chawl 5 & 6, Chinchpokli, Mumbai 400027 India"
Litti Express,"979 Adarsh Nagar Shiv Mandir Marg Near Lotus Petrol Pump, Mumbai 400102 India"
Little Italy,"18 B Juhu Tara Road, Near Maneckji Cooper School Hotel Atlantic, Mumbai 400049 India"
Liv,"145, 1st Floor, Mahatma Gandhi Road, Kala Ghoda Fort, Mumbai 400001 India"
Lmnopq,"Khar Pali Road next to Cafe Mangii, Mumbai 400052 India"
Lobby Lounge,"Sahar Andheri Kurla Road The Leela, Mumbai 400059 India"
Lobby Lounge - Grand Hyatt Mumbai Hotel and Residences,"Bandra Kurla Complex Vicinity, Off Western Express Highway, Santacruz East,, Mumbai 400055 India"
Loco Chino,"Peddar Road Shop 1, Ketty House, Gopalrao Deshmukh Marg, Mumbai 400026 India"
Loco Loca,"Oberoi Complex, The Empresa Hotel, SAB TV Lane, Off New Link Road, Mumbai 400053 India"
Locoloca,"lokhandwala Andheri, Mumbai 400053 India"
Lom Chings,"19, Wing B, Poonam Darshan, Poonam Nagar Near State Bank Of India and Axis Bank ATM, Andheri East, Mumbai 400093 India"
Lomchin Wok,"90 90'th Feet Road, Mumbai 400081 India"
London Taxi Gastropub- Khar,"Gabbana House 2nd Floor 15'th Road Khar West, Mumbai 400052 India"
Lord of the Drinks,"New link Road Ground Floor, Aver House, Veera Desai Area, Mumbai 400053 India"
Lord of the Drinks,"Kamala Mills Compound 3rd Floor , Trade View Building ,, Mumbai 400013 India"
Lord of the Drinks,"Senapati Bapat Marg Lower Parel, Trade View Building, Kamala Mills Compound, Mumbai 400013 India"
Lord of the Drinks Powai,"Orchard Avenue J M House, Delphi, Wing B, Unit No 5, 1st Floor, Hiranandani Gardens, Mumbai 400076 India"
Lotus Cafe,"Juhu Tara Road JW Marriott, Mumbai 400049 India"
Lotus Court,"21 RH, Inside Laxmi Industrial Estate, New Link Road, Andheri Lokhandwala, Andheri West Inside Laxmi Industrial Estate, Mumbai 400053 India"
Lotus Leaf,"Off Link Rd Eskay Resorts, Mumbai 400091 India"
Lounge at Taj Wellington Mews,"Lobby Floor 33 Nathalal Parekh Marg Taj Wellington Mews, Mumbai 400005 India"
Lounge Bar,"Sahar Airport Rd, Ashok Nagar, Andheri East Hilton Mumbai International Airport, Mumbai 400099 India"
Loyalty Lounge,"Chhatrapati Shivaji International Airport Area, Vile Parle, Mumbai 400047 India"
LSD - Love Sugar & Dough,"Chinoy Mansion, Warden Road, Next To Precious Hair Dressers, Breach Candy Next To Precious Hairdresser, Cumballa Hill, Mumbai 400036 India"
Lubss Cafe & Fast Food,"Old Sridevi Bungalow, Ramee Guest Line, Near Novotel Hotel & Sun n Sand Hotel AB Nair Road, Mumbai 400049 India"
Lucknowi Legacy,"9c & 10 Meera Tower Goregaon Link Road, Mumbai 400102 India"
Lucky Biryani,"4 & 5, A Wing, Vaibhav Palace, Malad Andheri Link Road, Jogeshwari West, Oshiwara, Andheri West Oshiwara, Jogeshwari West, Near Oshiwara Bus Depot, Mumbai 400053 India"
Lucky Dragon,"6 Shop No, Mumbai 400016 India"
Lucky Restaurant,"Hill road Junction of Hill Road and S.V. Road, Mumbai 400050 India"
Lucky Sandwich & Pizza Corner,"Shop No. 1, Bajaj Road, Near Bank of Baroda, Vile Parle West, Mumbai 400056 India"
Lume Restaurant & Bar,"Sir Mathuradas Vasanji Road Hotel Aureole, Bima Nagar Society, Telli Gali, Near Andheri East Station, Mumbai 400069 India"
Luna,"Regis Mumbai Level 37 The St 462 Senapati Bapat Marg, Lower Parel, Mumbai 400013 India"
Lung Fung,"No 9 13 New Rajshree Building Shop, Mumbai 400066 India"
Maa Anjani Pav Bhaji Center,"22 Link Road Kalpana chawla chowk, shimpoli road, haridas nagar, Borivali west, Mumbai 400092 India"
Mabruk,"Domestic Airport Western Express Highway Hotel Sahara Star, Mumbai 400099 India"
Made in Punjab,"Level 2, Inorbit Mall, Malad West, Mumbai 400064 India"
Madeira & Mime,"Transocean House, Lake Boulevard, Powai, Mumbai 400076 India"
Madhuram Sweets and Farsan House,"Lokmanya Tilak Road, Opposite Goyal Shopping Centre, Borivali West, Mumbai 400092 India"
Madina Hotel Restaurant,"82 Lj Road, Near St Michaels Church, Mumbai 400016 India"
Madras Bhuvan,"445-451, Kalbadevi Road, Mumbai 400002 India"
Madras Cafe,"22/A, Aziz Mansion, Shahid Bhagat Singh Road Colaba, Near Lakshmi Vilas Bank ATM, Mumbai 400056 India"
Madras diaries,"117 Waterfield Road Shop 7, Ground Floor, Muzaffar Manor, Mumbai 400050 India"
Madras Idli,"Pahadi Eskar Station Road Anupam Chitra Mandir, Near Bata Showroom, Mumbai 400063 India"
Maffy's,"Sea Palace Hotel Apollo Bunder, Colaba, Mumbai 400005 India"
Mahalaxmi Fast Food,"22, Juhu Beach, Juhu Tara Road, Juhu, Mumbai 400049 India"
Maharaja,"Chakala Road, Mumbai 400099 India"
Maharaja Bhog,"Juhu Tara Road Opposite Juhu Beach, Chowpatty Bus Stop, Mumbai 400047 India"
Maharaja Bhog,"126 Almac House Senapati Bapat Marg Lower Parel, opp. Kamla Mills Compund., Mumbai 400013 India"
Maharaja Bhog,"Inorbit Mall, 2nd Floor, Link Road, Mindspace, Malad West Inorbit Mall, Hypercity, Malad West, Mumbai 400064 India"
Maharaja Bhog,"Central Avenue Above Haiko Supermarket, Haiko Mall, Level 1, Hiranandani Gardens, Mumbai 400076 India"
Maharaja Bhog,"Oberoi Mall 3rd Floor Film City Road, Mumbai 400063 India"
Maharaja Bhog,"Malad West Infiniti Mall, Mumbai 400064 India"
Maharaja Bhog - Premium Veg Thali,"Central Avenue First floor, Haiko Mall, Hiranandani gardens, Powai, Mumbai 400076 India"
Mahesh Lunch Home,"8 - B Cawasji Patel Street, Opposite Axis Bank, Mumbai 400001 India"
Mahesh Lunch Home,"Andheri Kurla Road Saki Naka Metro Station, Andheri East, Mumbai 400069 India"
Mahesh Lunch Home,"Pokran Road No. 1 Opp. Raymonds, Thane West, Mumbai 400606 India"
Mahesh Lunch Home,"Bhagwan Mahaveer Rd Platinum Techno Park, Sector 30A, Mumbai 400705 India"
Mahesh Lunch Home,"Juhu Tara Road Kings Apartment, Next to J.W. Marriott, Mumbai 400049 India"
Mahesh Lunch Home,"2 Govinda Sagar Marg Vidyanagari, Mumbai 400098 India"
Mainland china,"2nd Floor Block A, Mumbai 400076 India"
Mainland China,"6th Floor Linking Road Above Shoppers Stop, Bandra West, Mumbai 400050 India"
Mainland China,"Western Express Highway 101 Gower Mall, Mumbai 400101 India"
Mainland China,"Link Road 3rd Floor, Infinity Mall 2, Malad West, Mumbai 400064 India"
Mainland China,"Ground Floor, Shalimar Morya Park, Off New Link Rd, Andheri, Mumbai 400053 India"
Mainland China,"Sakinaka Junction, Andheri Kurla Road, Opposite HP Petrol Pump, Andheri East, Mumbai 400072 India"
Mainland China,"Central Avenue 1st Floor City Park Building, Mumbai 400076 India"
Mainland China,"R City Mall, 3rd Floor, Amrut Nagar, LBS Marg, Ghatkopar West Ghatkopar, Mumbai 400086 India"
Mainland China Asia Kitchen,"462 Phoenix Mills Compound 3rd Floor Senapati Bapat Marg, Mumbai 400013 India"
Mainland China Restaurant,"Sobo Central Unit Tulsiwadi, Mumbai 400034 India"
Mainland China Restaurant,"4th Floor Morya Landmark - 1 B Dalia Industrial Estate Road B/25, Morya Landmark - 1, 4th Floor, Veera Industrial Estate, Andheri West, Mumbai 400053 India"
"Mainland china, growel mall, kandivali east, mumbai","Kandivali East, Mumbai 400101 India"
Maji Sagar,"& 2 1 Maji Sagar Pandit Madan Mohan Malaviya Road Maji Sagar Maji Sagar Maji Sagar Opposite Air Conditioned Market Opposite Tardeo A/C Market, Tardeo, Mumbai 400034 India"
Makani,"Lal Bahadur Shastri Rd Lorven House, opp Magnet Mall, Bhandup West, Mumbai 400078 India"
Malabar Hill Club,"13 B G Kher Road Malabar Hill, Mumbai 400006 India"
Maldrin's,"3 4 Sunder Lane Behind Orlem Chruch, Malad West, Mumbai 400064 India"
Malgudi,"Fc - 10 Oberoi Mall 3rd Floor Western Express Highway Shop No, Mumbai 400063 India"
Malgudi,"2nd Floor, Infiniti Mall, Next To Raheja Classique Complex, Oshiwara New Link Road, Andheri West, Mumbai 400053 India"
Malgudi,"2 & 3 Plot 57 Gorai II, Gorai, Borivali, Mumbai 400091 India"
Malhaar Restaurant & Bar,"Ground Floor, Pearl Hotel Building, DK Sandu Marg, 19th Road, Chembur East,, Mumbai 400071 India"
Malhar Tribes,"Marol Maroshi Road, Mumbai 400059 India"
Malvan Katta Restaurant,"DL Vaidya Road Tata Road, Opposite Shivaji Park, Mumbai 400005 India"
Malvan Samudra,"Narendra Bhuvan, Vikhroli Station Road, Below Old Court Building, Vikhroli West, Mumbai 400083 India"
Malwani Aswad,"Shahaji Raje Marg Opposite Bhoota High School, Vile Parle East, Mumbai 400057 India"
Malwani Kalwan,"Sunder Lane, Mumbai 400064 India"
Malwani Kkalwan,"7 Aram Nagar Road, Mumbai 400061 India"
Mama Kane,"222 Smruti Kunj Senapati Bapat Marg Near Dadar Railway Station, Dadar West, Mumbai 400028 India"
Mama Mia Pizza,"1 A R Rangnekar Road Parmanand Building, French Bridge, Opera House Po, Mumbai 400004 India"
Mama Mia!,"21/22, Byculla House, Clare Road, Next to Bank of Baroda, Byculla, Mumbai 400008 India"
Mamagoto,"5, Surya Mahal, Burjarji Bharucha Marg, Kalaghoda, Fort Kalaghoda Fort, Mumbai 400001 India"
Mamagoto,"Surya Mahal, Near Stock Exchange, Mumbai - 400023, Mumbai 400023 India"
Mamagoto,"133, Ground Floor, Gazebo House, Hill Road Opposite City Mall, New Link Road, Andheri West, Mumbai, Mumbai 400053 India"
Mamagoto,"B - 40 Opp City Mall Unit 1 - 5 New Link Road, Mumbai 400053 India"
Mamagoto,"B 40, Unit 1 -5, Patel Commercial Premises Cooperative Society Ltd, Opposite City Mall, New Link Road, Andheri West, Mumbai 400053 India"
Mamgato,"5 Boman Behram Marg, Mumbai 400001 India"
